<?xml version="1.0" encoding="UTF-8" ?>

<mocking-templates version="1.0"
    xmlns="http://moreunit.org/mock/mocking-templates"
    xmlns:xsi="http://www.w3.org/2001/XMLSchema-instance"
    xsi:schemaLocation="
        http://moreunit.org/mock/mocking-templates http://moreunit.sourceforge.net/schemas/mocking-templates.xsd
    ">
    <category id="org.moreunit.mock.mockito" name="Mockito"/>
    <mocking-template
        id="org.moreunit.mock.mockitoWithoutAnnotations"
        category="org.moreunit.mock.mockito"
        name="Without annotations">
        <code-template id="dependencyDeclaration" part="test-class-fields">
            <pattern><![CDATA[
            
                private ${dependencyType} ${dependency} = ${mockMethod:importStatic(org.mockito.Mockito.mock)}mock(${dependencyType}.class);
            ]]></pattern>
        </code-template>
        <code-template id="objectUnderTestDeclaration" part="test-class-fields">
            <pattern><![CDATA[
            
                private ${objectUnderTestType} ${objectUnderTest};
            ]]></pattern>
        </code-template>
        <code-template id="objectUnderTestCreation" part="before-instance-method">
            <exclude-if condition="injection-type" value="constructor"/>
            <pattern><![CDATA[${objectUnderTest} = new ${objectUnderTestType}();]]></pattern>
        </code-template>
        <code-template id="constructorInjection" part="before-instance-method">
            <include-if condition="injection-type" value="constructor"/>
            <pattern><![CDATA[${objectUnderTest} = ${:constructWithDependencies(objectUnderTest, dependency)};]]></pattern>
        </code-template>
        <code-template id="setterInjection" part="before-instance-method">
            <include-if condition="injection-type" value="setter"/>
            <pattern><![CDATA[${:setDependency(objectUnderTest, dependency)};]]></pattern>
        </code-template>
        <code-template id="fieldInjection" part="before-instance-method">
            <include-if condition="injection-type" value="field"/>
            <pattern><![CDATA[${:assignDependency(objectUnderTest, dependency)};]]></pattern>
        </code-template>
    </mocking-template>
    <mocking-template
        id="org.moreunit.mock.mockitoWithAnnotationsAndJUnitRunner"
        category="org.moreunit.mock.mockito"
        name="With annotations (Mockito &lt; 1.9, deprecated)">
        <code-template id="mockitoRunnerDeclaration" part="test-class-annotation">
        	<include-if condition="test-type" value="junit4"/>
            <pattern><![CDATA[@${runWith:newType(org.junit.runner.RunWith)}(${runner:newType(org.mockito.runners.MockitoJUnitRunner)}.class)]]></pattern>
        </code-template>
        <code-template id="dependencyDeclaration" part="test-class-fields">
            <pattern><![CDATA[
            
                @${mockAnnotation:newType(org.mockito.Mock)} private ${dependencyType} ${dependency};
            ]]></pattern>
        </code-template>
        <code-template id="objectUnderTestDeclaration" part="test-class-fields">
            <pattern><![CDATA[
            
                private ${objectUnderTestType} ${objectUnderTest};
            ]]></pattern>
        </code-template>
        <code-template id="mockInitialization" part="before-instance-method">
        	<exclude-if condition="test-type" value="junit4"/>
            <pattern><![CDATA[${mockitoAnnotations:newType(org.mockito.MockitoAnnotations)}.initMocks(this);]]></pattern>
        </code-template>
        <code-template id="objectUnderTestCreation" part="before-instance-method">
            <exclude-if condition="injection-type" value="constructor"/>
            <pattern><![CDATA[${objectUnderTest} = new ${objectUnderTestType}();]]></pattern>
        </code-template>
        <code-template id="constructorInjection" part="before-instance-method">
            <include-if condition="injection-type" value="constructor"/>
            <pattern><![CDATA[${objectUnderTest} = ${:constructWithDependencies(objectUnderTest, dependency)};]]></pattern>
        </code-template>
        <code-template id="setterInjection" part="before-instance-method">
            <include-if condition="injection-type" value="setter"/>
            <pattern><![CDATA[${:setDependency(objectUnderTest, dependency)};]]></pattern>
        </code-template>
        <code-template id="fieldInjection" part="before-instance-method">
            <include-if condition="injection-type" value="field"/>
            <pattern><![CDATA[${:assignDependency(objectUnderTest, dependency)};]]></pattern>
        </code-template>
    </mocking-template>
    <mocking-template
        id="org.moreunit.mock.mockitoWithAnnotationsAndJUnitRunner1.9"
        category="org.moreunit.mock.mockito"
        name="With annotations">
        <code-template id="mockitoRunnerDeclaration" part="test-class-annotation">
        	<include-if condition="test-type" value="junit4"/>
            <pattern><![CDATA[@${runWith:newType(org.junit.runner.RunWith)}(${runner:newType(org.mockito.runners.MockitoJUnitRunner)}.class)]]></pattern>
        </code-template>
		<code-template id="mockitoExtensionDeclaration" part="test-class-annotation">
        	<include-if condition="test-type" value="junit5"/>
            <pattern><![CDATA[@${runWith:newType(org.junit.jupiter.api.extension.ExtendWith)}(${runner:newType(org.mockito.junit.jupiter.MockitoExtension)}.class)]]></pattern>
        </code-template>
        <code-template id="dependencyDeclaration" part="test-class-fields">
            <pattern><![CDATA[
            
                @${mockAnnotation:newType(org.mockito.Mock)} private ${dependencyType} ${dependency};
            ]]></pattern>
        </code-template>
        <code-template id="objectUnderTestDeclaration" part="test-class-fields">
            <pattern><![CDATA[
            
                @${injectMocksAnnotation:newType(org.mockito.InjectMocks)} private ${objectUnderTestType} ${objectUnderTest};
            ]]></pattern>
        </code-template>
        <code-template id="mockInitialization" part="before-instance-method">
        	<exclude-if condition="test-type" value="junit4"/>
        	<exclude-if condition="test-type" value="junit5"/>
            <pattern><![CDATA[${mockitoAnnotations:newType(org.mockito.MockitoAnnotations)}.initMocks(this);]]></pattern>
        </code-template>
    </mocking-template>
    <mocking-template
        id="org.moreunit.mock.mockitoWithPowermockAndAnnotations"
        category="org.moreunit.mock.mockito"
        name="With PowerMock">
        <code-template id="preparationOfClassesToMock" part="test-class-annotation">
            <pattern><![CDATA[@${prepareForTest:newType(org.powermock.core.classloader.annotations.PrepareForTest)}(/* TODO specify classes to prepare for test */)]]></pattern>
        </code-template>
        <code-template id="powermockRunnerDeclaration" part="test-class-annotation">
            <include-if condition="test-type" value="junit4"/>
            <pattern><![CDATA[@${runWith:newType(org.junit.runner.RunWith)}(${runner:newType(org.powermock.modules.junit4.PowerMockRunner)}.class)
]]></pattern>
        </code-template>
        <code-template id="dependencyDeclaration" part="test-class-fields">
            <pattern><![CDATA[
            
                @${mockAnnotation:newType(org.mockito.Mock)} private ${dependencyType} ${dependency};
            ]]></pattern>
        </code-template>
        <code-template id="objectUnderTestDeclaration" part="test-class-fields">
            <pattern><![CDATA[
            
                @${injectMocksAnnotation:newType(org.mockito.InjectMocks)} private ${objectUnderTestType} ${objectUnderTest};
            ]]></pattern>
        </code-template>
        <code-template id="objectFactoyDeclaration" part="test-class-fields">
            <include-if condition="test-type" value="testng"/>
            <pattern><![CDATA[
            
                @${objectFactory:newType(org.testng.annotations.ObjectFactory)}
public ${iObjectFactory:newType(org.testng.IObjectFactory)} getObjectFactory() {
    return new ${powerMockObjectFactory:newType(org.powermock.modules.testng.PowerMockObjectFactory)}();
}
            ]]></pattern>
        </code-template>
        <code-template id="mockInitialization" part="before-instance-method">
        	<exclude-if condition="test-type" value="junit4"/>
        	<exclude-if condition="test-type" value="junit5"/>
            <pattern><![CDATA[${mockitoAnnotations:newType(org.mockito.MockitoAnnotations)}.initMocks(this);]]></pattern>
        </code-template>
    </mocking-template>
</mocking-templates>
