<?xml version="1.0" encoding="UTF-8" ?>

<mocking-templates version="1.0"
    xmlns="http://moreunit.org/mock/mocking-templates"
    xmlns:xsi="http://www.w3.org/2001/XMLSchema-instance"
    xsi:schemaLocation="
        http://moreunit.org/mock/mocking-templates http://moreunit.sourceforge.net/schemas/mocking-templates.xsd
    ">
    <category id="org.moreunit.mock.jmockit" name="JMockit"/>
    <mocking-template
        id="org.moreunit.mock.jmockitDefault"
        category="org.moreunit.mock.jmockit"
        name="Default">
        <code-template id="jmockitRunnerDeclaration" part="test-class-annotation">
            <include-if condition="test-type" value="junit4"/>
            <pattern><![CDATA[@${runWith:newType(org.junit.runner.RunWith)}(${runner:newType(mockit.integration.junit4.JMockit)}.class)]]></pattern>
        </code-template>
        <code-template id="jmockitRunnerDeclaration" part="test-class-annotation">
            <include-if condition="test-type" value="junit5"/>
            <pattern><![CDATA[@${runWith:newType(org.junit.jupiter.api.extension.ExtendWith)}(${runner:newType(mockit.integration.junit5.JMockitExtension)}.class)]]></pattern>
        </code-template>
        <code-template id="dependencyDeclaration" part="test-class-fields">
            <pattern><![CDATA[
            
                @${injectableAnnotation:newType(mockit.Injectable)} private ${dependencyType} ${dependency};
            ]]></pattern>
        </code-template>
        <code-template id="objectUnderTestDeclaration" part="test-class-fields">
            <pattern><![CDATA[
            
                @${mockAnnotation:newType(mockit.Tested)} private ${objectUnderTestType} ${objectUnderTest};
            ]]></pattern>
        </code-template>
    </mocking-template>
    <mocking-template
        id="org.moreunit.mock.jmockitWithoutJunitRunWith"
        category="org.moreunit.mock.jmockit"
        name="Without JUnit's @RunWith">
        <code-template id="dependencyDeclaration" part="test-class-fields">
            <pattern><![CDATA[
            
                @${injectableAnnotation:newType(mockit.Injectable)} private ${dependencyType} ${dependency};
            ]]></pattern>
        </code-template>
        <code-template id="objectUnderTestDeclaration" part="test-class-fields">
            <pattern><![CDATA[
            
                @${mockAnnotation:newType(mockit.Tested)} private ${objectUnderTestType} ${objectUnderTest};
            ]]></pattern>
        </code-template>
    </mocking-template>
</mocking-templates>
